Statute,Type of Information Withheld,Case Citation,Number of Times Relied upon per Component,Number of Times Relied upon per Component,Total Number of Times Relied upon by Agency
F.R. Cr. P. 6(e),Records relating to Grand Jury Investigations or Proceedings,"Senate of Puerto Rico v. U.S. Department of Justice, 823 F2d 574, (D.D.C. 1987).",1,HQ,1
P.I. Act 41 U.S.C b(m)(1),Procurement Integrity Act: Contract Proposals,"Hornbosel v. Dept. of Interior, 305 F. Supp. 2d 21 (D.D.C. 2003) as amended (2004), aff?d on other grounds, 2004 WL1900562 (D.C. Cir. 2004).",2,HQ,2
FIFRA 7 U.S.C. 136h Sect. 10g,"Federal Insecticide, Fungicide, and Rodenticide Act 7 U.S.C. 136 h, Section 10 (g): Analytical, health, environmental effects and efficacy data that prohibits registrants from disclosing information to foreign competitors",N,19,HQ,19
FIFRA 7 U.S.C. 136h Sect. 10,"Federal Insecticide, Fungicide, and Rodenticide Act 7 U.S.C. 136h Section 10(g): Studies from registrants who engage in the distribution of pesticides in countries other than the U.S.",N,1,HQ,1
ADR Act U.S.C. Section 547(j),1996 ADR Act. U.S.C. Section 574 (j),N,1,Region 5,1
P.I.A. 41 U.S.C. 253b(m)(1),"Procurement Integrity Ad, 41 U.S.C. 253b(m)(1): Contract Proposal","Hornbosel v. Dept. of Interior, 305 F. Supp. 2d 21 (D.D.C. 2003) as amended (2004), aff?d on other grounds, 2004 WL1900562 (D.C. Cir. 2004).",1,HQ,1
