Statute,Type of Information Withheld,Case Citation,Number of Times Relied upon per Component,Number of Times Relied upon per Component,Total Number of Times Relied upon by Agency
"FTC Act Section 6f, 15 U.S.C. §46(f)",?Any trade secrets or any commercial or financial information which is obtained from any person and which is privileged or confidential.?,"Its use was upheld in Doherty v. FTC, 1981-1 Trade Cas. (CCH) § 64,117 (D.D.C. June 24, 1981).",50,FTC,50
"FTC Act Section 21b, 15 U.S.C. §57b-2(b)",Materials received pursuant to compulsory process in a law enforcement investigation.,"Its use was upheld in Dairymen, Inc. v. FTC, 1980-2 Trade Cas. (CCH) ¶ 63,479 (D.D.C. July 9, 1980).",2,FTC,2
"FTC Act Section 21f, 15 U.S.C. §57b-2(f)",Material obtained pursuant to process or voluntarily in lieu of process in a law enforcement investigation.,"Its use was upheld in A. Michael?s Piano v. FTC, 18 F.3d 138 (2d Cir. 1994).",133,FTC,133
"Clayton Act (Hart-Scott-Rodino Provisions), Section 7A(h), 15 U.S.C. §18a(h)",Material filed pursuant to the premerger (HSR) provisions of the Act.,"Its use was upheld in Lieberman v. FTC, 771 F.2d 32 (2nd Cir. 1985).",13,FTC,13
"Section 1114 of the Medicare Prescription Drug, Improvement, and Modernization Act of 2003, 21 U.S.C. § 355",Any information or documentary material that may have been filed pursuant to the pharmaceutical agreement notification.,None,1,FTC,1
