Request Number,Office,Date Closed,Summary of Request,Disposition of Request,Exemption(s) Applied (if applicable),Description of Exemption(s) (if applicable)
FOIA-2012-00457,OAG,8/30/12,"Minutes of meetings that took place on May 23, 24, and 26, 2011, regarding the extradition treaty between the United Kingdom and United States",No Records,,
FOIA-2012-00528,OAG,8/30/12,Copy of a memorandum concerning access and use of certain terrorism information,Partial No Records/Partial Glomar Denial: Neither confirmed nor denied the existence of certain law enforcement records,(b)(1),Information that is classified by Executive Order to protect national security 
FOIA-2012-00577,OAG,8/30/12,Correspondence between the Office of the Attorney General and members of the Petitioners’ Steering Committee of the Autism Omnibus of the National Vaccine Injury Compensation Program,No Records,,
FOIA-2012-00604,OAG,8/30/12,Records contained in various Federal Bureau of Investigation (FBI) files,Full Grant/Partial Referral: Referred material to the National Security Division for direct response to requester,,
FOIA-2012-00877,OASG,8/30/12,"Copies of correspondence between the Department and Governor Mitch Daniels’ Office from January 10, 2005 to the present and Governor Bob McDonnell’s Office from January 16, 2010 to the present",No Records,,
FOIA-2012-00925,OLA,8/30/12,"Copies of correspondence between the Department and Governor Mitch Daniels’ Office from January 10, 2005 to the present and Governor Bob McDonnell’s Office from January 16, 2010 to the present",No Records,,
FOIA-2012-00876,ODAG,8/30/12,"Copies of correspondence between the Department and Governor Mitch Daniels’ Office from January 10, 2005 to the present and Governor Bob McDonnell’s Office from January 16, 2010 to the present",No Records,,
FOIA-2012-01075,OIP,8/30/12,Log of all FOIA requests received by the Department of Justice concerning former Representative and Governor George Allen,Full Grant,,
FOIA-2012-01212,OIP,8/30/12,Records pertaining to the contents of a FOIA administrative appeal file,Full Grant/Partial Referral: Referred material to the FBI for processing and direct response to the requester ,,
FOIA-2012-01270,OIP,8/30/12,Copies of various materials pertaining to the Freedom of Information Act,Provided requester with 100 pages of training materials and guidance from the OIP website and informed requester that further production of materials would incur duplication fees,,
FOIA-2012-01282,PAO,8/30/12,"Copies of communications between the Office of Public Affairs and Media Matters regarding the book Injustice, Espousing the Racial Agenda of the Obama Justice Department",No Records,,
FOIA-2012-01206,OIP,8/30/12,"Records regarding various local law  enforcement policies, including the use of taser gun and public safety  cameras for the city of Richmond, California","Provided requester with a link to a relevant DOJ Office of the Inspector General report, and referred requester to the California Attorney General's Office in order to access state records",,
FOIA-2012-01284,ODAG,8/31/12,Various final documents pertaining to the legal reasoning and authority relied upon by the FBI when conducting investigations and assessments,Full Grant,,
FOIA-2012-01283,OAG,8/31/12,Various final documents pertaining to the legal reasoning and authority relied upon by the FBI when conducting investigations and assessments,Full Grant,,
