Request Number,Office,Date Closed,Summary of Request,Disposition of Request,Exemption(s) Applied (if applicable),Description of Exemption(s) (if applicable)
FOIA-2012-01344,OASG,8/17/12,"Records concerning a April 30, 2009 meeting between individuals at the Office of the Associate Attorney General, the Civil Rights Division, and third parties regarding Section 7 of the National Voting Rights Act (NVRA), as well as records concerning a May 17,2011  meeting between individuals at the Office of the Associate Attorney General and voting rights groups regarding Section 7 of the NVRA",Determined that records were improperly referred to OIP for processing and forwarded records back to entity originally handling request for further processing,,
FOIA-2012-01278,OIP,8/20/12,"Information pertaining to various statutes, including the Civil Rights of Institutionalized Persons Act (CRIPA), and inmate grievance procedures","Determined that the FBI, Federal Bureau of Prisons, Executive Office for United States Attorneys, and  Criminal Division, DOJ, were the most appropriate entities for handling, and informed requester that the Mail Referral Unit had already routed the request to these components for processing; Also determined that the Civil Rights Division, DOJ, was an appropriate entity for handling and referred requester to that component",,
FOIA-2012-01233,OIP,8/20/12,Asking various questions concerning privacy rights,Informed requester that the FOIA is a records access statute and is not applicable to this query; Provided a website link to the DOJ FOIA Reference Guide for information on making a FOIA request; Provided FOIA contact information for FCC if requester determined that they are seeking information regarding communications technology,,
FOIA-2012-01241,OIP,8/20/12,Requesting an investigation into the State of California,Informed requester that the FOIA is a records access statute and is not applicable to this query and referred requester to the DOJ online Action Center,,
FOIA-2012-01294,OIP,8/20/12,"Copies of proposal response submitted by Lockheed Martin for the Enterprise Standard Architecture IV (ESA IV) contract, as well as award documentation",Determined that the U.S. Marshals Service and ATF were the most appropriate entities for handling and referred requester to those components for processing,,
FOIA-2011-00443,PAO,8/20/12,"Records sent to or from the Offices of the Attorney General, Deputy Attorney General, Public Affairs, Professional Responsibility, or the Executive Office for United States Attorneys, concerning USA Today’s reporting about prosecutorial misconduct or three specific FOIA requests made by USA Today from April 1, 2009 to December 31, 2010. ",Partial Grant/Partial Denial,(b)(6),Information the release of which would constitute a clearly unwarranted invasion of the personal privacy of a third party 
FOIA-2011-00609,OAG,8/20/12,"Records pertaining to a March 15, 2011 meeting, and any subsequent meetings, between the Department of Justice and groups concerned with gun policy, excluding logistical materials",Partial Grant/Partial Denial,(b)(5); (b)(6),Certain inter- and intra-agency communications protected by legal privileges; Information the release of which would constitute a clearly unwarranted invasion of the personal privacy of a third party 
FOIA-2011-00610,ODAG,8/20/12,"Records pertaining to a March 15, 2011 meeting, and any subsequent meetings, between the Department of Justice and groups concerned with gun policy, excluding logistical materials",Partial Grant/Partial Denial,(b)(5); (b)(6),Certain inter- and intra-agency communications protected by legal privileges; Information the release of which would constitute a clearly unwarranted invasion of the personal privacy of a third party 
FOIA-2011-00707,OLP,8/20/12,"Records pertaining to a March 15, 2011 meeting, and any subsequent meetings, between the Department of Justice and groups concerned with gun policy, excluding logistical materials",Partial Grant/Partial Denial,(b)(5); (b)(6),Certain inter- and intra-agency communications protected by legal privileges; Information the release of which would constitute a clearly unwarranted invasion of the personal privacy of a third party 
FOIA-2011-00956,OLA,8/20/12,"Records pertaining to a March 15, 2011 meeting, and any subsequent meetings, between the Department of Justice and groups concerned with gun policy, excluding logistical materials",Partial Grant/Partial Denial,(b)(5); (b)(6),Certain inter- and intra-agency communications protected by legal privileges; Information the release of which would constitute a clearly unwarranted invasion of the personal privacy of a third party 
FOIA-2012-00558,OIP,8/20/12,Copies of specific FOIA requests submitted to OIP,Partial Grant/Partial Denial,(b)(6),Information the release of which would constitute a clearly unwarranted invasion of the personal privacy of a third party 
FOIA-2012-01183,ODAG,8/20/12,Records pertaining to the acquisition of sodium thiopental by the state of Georgia,Full Grant,,
FOIA-2012-01311,OAG,8/20/12,"Copies of all directives, memoranda, orders, instructions, and guidance that the “Office of the Attorney General has distributed to any and all [branches and divisions] of the [Department of Justice] in regards to processing FOIA requests” from January 1, 2011 and August 1, 2012","Provided requester with links to 2009 Attorney General FOIA Guidelines and OIP Guidance website, which includes all FOIA guidance disseminated on behalf of the Attorney General",,
FOIA-2010-00789,OAG,8/21/12,Copies of Attorney General Holder's calendars for the month of July 2009.,Partial Grant/Partial Denial,(b)(6); (b)(7)(E); (b)(7)(F),"Information the release of which would constitute a clearly unwarranted invasion of the personal privacy of a third party;   Records or information compiled for law enforcement purposes, the release of which would disclose techniques and procedures for law enforcement investigations or prosecutions;  Records or information compiled for law enforcement purposes, the release of which could reasonably be expected to endanger the life or physical safety of an individual"
FOIA-2010-00599,OAG,8/21/12,"Copy of Attorney General Holder's daily schedules from November 2, 2009 through November 13, 2009.",Partial Grant/Partial Denial,(b)(5); (b)(6); (b)(7)(E); (b)(7)(F),"Certain inter- and intra-agency communications protected by legal privileges; Information the release of which would constitute a clearly unwarranted invasion of the personal privacy of a third party;   Records or information compiled for law enforcement purposes, the release of which would disclose techniques and procedures for law enforcement investigations or prosecutions;  Records or information compiled for law enforcement purposes, the release of which could reasonably be expected to endanger the life or physical safety of an individual"
FOIA-2011-00518,OAG,8/21/12,Records concerning a third party,Partial Grant/Partial Glomar Denial: Neither confirmed nor denied the existence of certain law enforcement records,(b)(7)(C),"Records or information compiled for law enforcement purposes, the release of which could reasonably be expected to constitute an unwarranted invasion of the personal privacy of a third party"
FOIA-2011-00638,ODAG,8/21/12,"Records from September 1, 2009 to the present pertaining to the acquisition, importation, or transfer of sodium thiopental, pentrobarbital, pancuronium bromide, potassium chloride, or any other drug used for carrying out executions",No Records,,
FOIA-2011-01019,OAG,8/21/12,Records contained within specific Federal Bureau of Investigation (FBI) files,Partial Grant/Partial Denial,(b)(6); (b)(7)(C) ,"Information the release of which would constitute a clearly unwarranted invasion of the personal privacy of a third party; Records or information compiled for law enforcement purposes, the release of which could reasonably be expected to constitute an unwarranted invasion of the personal privacy of a third party"
FOIA-2012-01026,ODAG,8/21/12,"Copies of correspondence between the Department of Justice, Senator George Allen of the state of Virginia (including from or on behalf of the Senator in his capacity as a private citizen), Paul Unger, and certain private entities",No Records,,
FOIA-2012-01027,OASG,8/21/12,"Copies of correspondence between the Department of Justice, Senator George Allen of the state of Virginia (including from or on behalf of the Senator as a private citizen), Paul Unger, and several private entities",No Records,,
FOIA-2012-01098,OAG,8/21/12,Documents concerning the Las Vegas Sands Corporation,No Records,,
FOIA-2012-01099,ODAG,8/21/12,Documents concerning the Las Vegas Sands Corporation,No Records,,
FOIA-2012-01100,OASG,8/21/12,Documents concerning the Las Vegas Sands Corporation,No Records,,
FOIA-2012-01321,OIP,8/22/12,"copy of the most recent Corporate Integrity Agreement between Symphony Diagnostic Services, Inc. and the Office of the Inspector General of the U.S. Department of Health and Human Services","Determined that the Dep't of Health and Human Services was the most appropriate agency for handling, and referred requester to that agency for processing",,
FOIA-2010-00292,OAG,8/22/12,Copies of AG Holder's calendars for May through August 2009,Partial Grant/Partial Denial,(b)(5); (b)(6); (b)(7)(E); (b)(7)(F),"Certain inter- and intra-agency communications protected by legal privileges; Information the release of which would constitute a clearly unwarranted invasion of the personal privacy of a third party;   Records or information compiled for law enforcement purposes, the release of which would disclose techniques and procedures for law enforcement investigations or prosecutions;  Records or information compiled for law enforcement purposes, the release of which could reasonably be expected to endanger the life or physical safety of an individual"
FOIA-2010-00885,OAG,8/22/12,Copies of AG Holder's calendars for September and October 2009,Partial Grant/Partial Denial,(b)(5); (b)(6); (b)(7)(E); (b)(7)(F),"Certain inter- and intra-agency communications protected by legal privileges; Information the release of which would constitute a clearly unwarranted invasion of the personal privacy of a third party;   Records or information compiled for law enforcement purposes, the release of which would disclose techniques and procedures for law enforcement investigations or prosecutions;  Records or information compiled for law enforcement purposes, the release of which could reasonably be expected to endanger the life or physical safety of an individual"
FOIA-2012-01039,ODAG,8/22/12,"Copies of a cover letter and two memoranda from Special Counsel Patrick Fitzgerald to former President George W. Bush, summarizing evidence against Richard Armitage and Karl Rove in regard to the alleged unauthorized disclosure of a CIA agent's identity","No Records: Also determined that the Executive Office for United States Attorneys, DOJ, was the most appropriate entity for handling, and referred requester to that component for processing. ",,
FOIA-2012-01246,OLP,8/22/12,"Final recommendations on combating gun violence that the Justice Department may have sent to the White House following meetings held with gun control advocates in March, 2011, after the shootings in Tucson, Arizona",No Records,,
FOIA-2012-01331,OLA,8/22/12,Copy of the 9/11 Commission Report and information on budget appropriations from Congress for the Federal Bureau of Prisons,"Provided requester with publicly available information in the Congressional Budget for the Federal Bureau of Prisons, as well as information on obtaining a copy of the 9/11 commission report; also determined that the Justice Management Division, DOJ, was an appropriate entity for handling, and provided contact information for that component and advised requester that the request had already been referred to that component by the Mail Referral Unit",,
FOIA-2012-01325,OIP,8/23/12,Records related to the deceased Archbishop Paul C. Marcinkus,"Determined that the FBI and the Criminal Division, DOJ, were the most appropriate entities for handling, and referred requester to those components for processing",,
FOIA-2010-01253,OASG,8/23/12,"Copies of correspondence between Associate Attorney General Thomas Perrelli and/or his staff, and “BP Plc, Transocean Ltd, Anadarko Petroleum Corp and Halliburton Co. (including any units/subsidiaries) related to the Gulf of Mexico oil spill,” including communications regarding the establishment of the compensatory $20 billion escrow fund",Partial Grant/Partial Denial,(b)(4),Certain information that concerns trade secrets or other confidential commercial or financial information
FOIA-2010-01238,OAG,8/23/12,"Copies of “correspondence, including emails, relating to the establishment and ongoing operations of the independent claims facility that will administer the $20 billion escrow account to pay claims to victims of the Gulf of Mexico oil spill”  ",Partial Grant/Partial Denial,(b)(4),Certain information that concerns trade secrets or other confidential commercial or financial information
FOIA-2010-01239,OASG,8/23/12,"Copies of “correspondence, including emails, relating to the establishment and ongoing operations of the independent claims facility that will administer the $20 billion escrow account to pay claims to victims of the Gulf of Mexico oil spill”  ",Partial Grant/Partial Denial,(b)(4),Certain information that concerns trade secrets or other confidential commercial or financial information
FOIA-2010-01442,OAG,8/23/12,"Copies of external written and electronic correspondence from the Offices of the Attorney General and Associate Attorney General from April 2010 that relate “to the trust fund set up to compensate victims of the Deepwater Horizon oil spill... the role of the Gulf Coast Claims Facility, and the terms of employment and job responsibilities of Gulf Coast Claims Facility Administrator Kenneth Feinberg""",Partial Grant/Partial Denial,(b)(4),Certain information that concerns trade secrets or other confidential commercial or financial information
FOIA-2010-01443,OASG,8/23/12,"Copies of external written and electronic correspondence from the Offices of the Attorney General and Associate Attorney General from April 2010 that relate “to the trust fund set up to compensate victims of the Deepwater Horizon oil spill... the role of the Gulf Coast Claims Facility, and the terms of employment and job responsibilities of Gulf Coast Claims Facility Administrator Kenneth Feinberg""",Partial Grant/Partial Denial,(b)(4),Certain information that concerns trade secrets or other confidential commercial or financial information
FOIA-2012-01232,ODAG,8/23/12,"Department of Justice policies and procedures regarding ""Ethical Standards for Attorneys for the Government"" and ""Methods of Obtaining Documentary Materials Held by Third Parties""","Provided copy of Title 1-4.000 of U.S. Attorney's Manual (standards of conduct) and a copy of 28 C.F.R. § 77, which implements 28 U.S.C. § 530D, requiring Department attorneys to comply with state and local federal court rules for professional responsibility; Determined that the Professional Responsibility Advisory Office, DOJ, was also an appropriate entity for handling and referred requester to that component for processing",,
FOIA-2010-00099,OAG,8/24/12,Records pertaining to the Military Extraterritorial Jurisdiction Act (MEJA),"Partial Grant/Partial Denial/Partial Referral: Documents referred to the National Security Division, the Criminal Division, DOJ, and the Dep't of Defense for processing and direct response to the requester ",(b)(5); (b)(6): (b)(7)(C) ,"Certain inter- and intra-agency communications protected by legal privileges; Information the release of which would constitute a clearly unwarranted invasion of the personal privacy of a third party; Records or information compiled for law enforcement purposes, the release of which could reasonably be expected to constitute an unwarranted invasion of the personal privacy of a third party"
FOIA-2010-00100,ODAG,8/24/12,Records pertaining to the Military Extraterritorial Jurisdiction Act (MEJA),"Partial Grant/Partial Denial/Partial Referral: Documents referred to the National Security Division, the Criminal Division, DOJ, and the Dep't of Defense for processing and direct response to the requester ",(b)(5); (b)(6): (b)(7)(C) ,"Certain inter- and intra-agency communications protected by legal privileges; Information the release of which would constitute a clearly unwarranted invasion of the personal privacy of a third party; Records or information compiled for law enforcement purposes, the release of which could reasonably be expected to constitute an unwarranted invasion of the personal privacy of a third party"
FOIA-2012-00921,OAG,8/24/12,Complaints filed in the Ted Stevens Matter ,Request withdrawn by Requester,,
FOIA-2012-01328,OAG,8/24/12,"Documents regarding the Memorandum of Understanding signed on July 13, 2012, between the FBI and the Australian Federal Police, dealing with organized crime and terrorism ","No Records: Determined that the FBI was the most appropriate entity for handling, and referred  requester to that component for processing ",,
FOIA-2012-01329,ODAG,8/24/12,"Documents regarding the Memorandum of Understanding signed on July 13, 2012, between the FBI and the Australian Federal Police, dealing with organized crime and terrorism","No Records: Determined that the FBI was the most appropriate entity for handling, and referred  requester to that component for processing ",,
FOIA-2012-01330,OASG,8/24/12,"Documents regarding the Memorandum of Understanding signed on July 13, 2012, between the FBI and the Australian Federal Police, dealing with organized crime and terrorism","No Records: Determined that the FBI was the most appropriate entity for handling, and referred  requester to that component for processing ",,
FOIA-2012-01322,OIP,8/27/12,"Documents related to the June 12, 2012 decision to grant a waiver to the Federal Bureau of Prisons to connect to external systems through the Department of Justice Trusted Internal Connection","Determined that the Justice Management Division, DOJ, was the most appropriate entity for handling, and referred request and requester to that component for processing",,
FOIA-2012-01299,OIP,8/27/12,St. Clair County police reports,Informed requester that the FOIA does not apply to state or local records and directed requester to contact the St. Clair County Police Department for additional information,,
FOIA-2011-00569,ODAG,8/27/12,Records contained in six specific FBI files,Full Grant,,
FOIA-2011-00637,OAG,8/27/12,"Records from September 1, 2009, to the present pertaining to the acquisition, importation, or transfer of sodium thiopental, pentrobarbital, pancuronium bromide, potassium chloride, or any other drug used for carrying out executions",Full Grant,,
FOIA-2012-00324,OLA,8/27/12,"Any correspondence to the Department of Justice from or on behalf of the office of former U.S. Representative Christopher Shays between September 1, 1987 and January 3, 2009",Request withdrawn by Requester,,
FOIA-2012-00879,OAG,8/27/12,"Communications with Nancy-Ann DeParle or any other member of the Obama administration, or any third party regarding the development and implementation of ""alternative administrative measures""",No Records,,
FOIA-2012-00946,OAG,8/27/12,Former Congressman Christopher Shays,Request withdrawn by Requester,,
FOIA-2012-00947,ODAG,8/27/12,Former Congressman Christopher Shays,Request withdrawn by Requester,,
FOIA-2012-00948,OASG,8/27/12,Former Congressman Christopher Shays,Request withdrawn by Requester,,
FOIA-2012-00949,OLA,8/27/12,Former Congressman Christopher Shays,Request withdrawn by Requester,,
FOIA-2012-01102,OAG,8/27/12,Documents related to investigations of Bain Capital,No Records,,
FOIA-2012-01103,ODAG,8/27/12,Documents related to investigations of Bain Capital,No Records,,
FOIA-2012-01251,OIP,8/27/12,"Various records, memoranda, reports, opinions, guidance, and information from the DOJ and OIP websites","Provided requester with publicly available information from the DOJ and OIP websites, and informed requester that further production would incur duplication fees",,
FOIA-2012-01250,OAG,8/27/12,"Various records, memoranda, reports, opinions, guidance, and information from the DOJ and OIP websites","Provided requester with publicly available information from the DOJ and OIP websites, and informed requester that further production would incur duplication fees",,
FOIA-2012-01324,OLP,8/27/12,"Various records, memoranda, reports, opinions, guidance, and information from the DOJ and OIP websites","Provided requester with publicly available information from the DOJ and OIP websites, and informed requester that further production would incur duplication fees",,
FOIA-2012-01247,OIP,8/27/12,"""1) a task order for an audit of mortgage-backed securities fraud for the United States Attorney in Newark, New Jersey, and 2) records of reports submitted to Residential Mortgage-Backed Securities Working Group via www.stopfraud.gov/rmbs.html""","Determined for part 1 of the request that the Executive Office for United States Attorneys, DOJ, was the most appropriate entity for processing and referred request and requester to that component for processing; Determined for part 2 of the request that the Securities and Exchange Commission and the Office of the New York State Attorney General were the most appropriate entities for handling, and referred requester to those entities for further information",,
FOIA-2012-01323,OIP,8/27/12,"Various records, memoranda, reports, opinions, guidance, and information from the DOJ and OIP websites","Provided requester with publicly available information from the DOJ and OIP websites, and informed requester that further production would incur duplication fees",,
FOIA-2012-01332,ODAG,8/27/12,"Records pertaining to the Deputy Attorney General’s role at the Department of Justice, the Department’s mission in Iraq, and final orders and opinions issued by the Deputy Attorney General","Provided requester with information about the responsibilities of the Office of the Deputy Attorney General (ODAG), policy statements issued by the Deputy Attorney General, and documents available in the ODAG FOIA library, as well as public information concerning the Department's mission in Iraq",,
FOIA-2012-01334,OIP,8/27/12,Information on OIP's FOIA and Privacy Act procedures,Provided requester with a copy of the DOJ FOIA Reference Guide,,
FOIA-2012-01094,ODAG,8/28/12,"Records concerning ""license plate recognition technology""",No Records,,
FOIA-2012-01316,OIP,8/28/12,"Records from October 18, 2010 to the present maintained by the Civil Rights Division that contain the phrase “True the Vote”  ","Determined that the Civil Rights Division, DOJ, was the most appropriate entity for handling, and referred request and requester to that component for processing",,
FOIA-2012-00565,OAG,8/28/12,Attorney General guidance on correspondence between the Department and citizens,Request withdrawn by Requester,,
FOIA-2011-00598,PAO,8/29/12,"Copies of the Office of Public Affairs' Daily News Wrap e-mail since January 1, 2009",Partial Grant/Partial Denial: Request withdrawn by requester after initial production of documents,(b)(5),"Certain inter- and intra-agency communications protected by legal privileges 
"
FOIA-2011-00970,ODAG,8/29/12,Records on a DOJ investigation of Bank of America,Request withdrawn by Requester,,
FOIA-2011-00969,OAG,8/29/12,Records on a DOJ investigation of Bank of America,Request withdrawn by Requester,,
FOIA-2012-01287,OLA,8/29/12,A copy of a final or recent report issued on the Prison Rape Elimination Act (PREA),"Determined that the Office of Justice Programs, DOJ, was the most appropriate entity for handling, and referred requester to that component for processing; Provided link to information on the PREA on the Office of Justice Programs website",,
FOIA-2012-01338,OIP,8/30/12,"Any statutes, cases, administrative citations, policies, or other authority related to ""the use of student PINs""","Determined that the Dep't of Education was the most appropriate agency for handling, and referred requester to that agency for processing",,
FOIA-2012-01350,OIP,8/30/12,Records from the Department of Transportation (DOT) ,"Determined that the Dep't of Transportation was the most appropriate agency for handling, and referred requester to that agency for processing",,
FOIA-2012-01351,OIP,8/30/12,Records from the Department of Transportation (DOT),"Determined that the Dep't of Transportation was the most appropriate agency for handling, and referred requester to that agency for processing",,
FOIA-2012-01333,OIP,8/30/12,"Records (some from an historical time period) regarding ""anti-abortion terrorism""","Determined that the FBI, Executive Office for United States Attorneys, DOJ, and the National Archives and Records Administration were the most appropriate entities for handling and referred requester to those entities for processing",,
FOIA-2012-01347,OIP,8/30/12,Information regarding veterans' grants,"Determined that the Dep't of Veterans Affairs was the most appropriate agency for handling, and referred requester to that agency for processing",,
FOIA-2012-00253,PAO,8/30/12,"Copies of communication between Tracy Schmaler and  Media Matters for America or Media Matters Action Network between January 1, 2009 and the present",Partial Grant/Partial Denial,(b)(6),Information the release of which would constitute a clearly unwarranted invasion of the personal privacy of a third party 
