Request Number,Office,Date Closed,Summary of Request,Disposition of Request,Exemption(s) Applied (if applicable),Description of Exemption(s) (if applicable)
FOIA-2012-00887,OLP,5/18/12,Oaths of Office for U.S. District Court Judge Susan Bucklew and for two Assistant U.S. Attorneys,"Partial Grant/Partial Denial/Partial Referral: Determined that the Executive Office for United States Attorneys, DOJ, would be an appropriate entity for handling, and referred request and requester to that component for processing",(b)(6),Information the release of which would constitute a clearly unwarranted invasion of the personal privacy of a third party
FOIA-2012-00937,OAG,5/21/12,Records related to or about Daily Caller reporter Matthew (Matt) Boyle,No Records,,
FOIA-2012-00938,ODAG,5/21/12,Records related to or about Daily Caller reporter Matthew (Matt) Boyle,No Records,,
FOIA-2012-00939,OASG,5/21/12,Records related to or about Daily Caller reporter Matthew (Matt) Boyle,No Records,,
FOIA-2012-00779,OIP,5/21/12,Records related to or about Daily Caller reporter Matthew (Matt) Boyle,No Records,,
FOIA-2012-00936,OIP,5/22/12,"Copies of Attachment B of the Department of Justice FOIA Reference Guide, and current Department of Justice FOIA and Privacy Act regulations",Full Grant,,
FOIA-2012-00835,OIP,5/22/12,"All records used in compiling the list of FOIA Cases, in which a decision was rendered in 2011, in Section II of the DOJ 2011 FOIA Litigation and Compliance Report.","No Records/Partial Other: Determined that the Civil Division, DOJ, was the most appropriate entity for handling, and referred request and requester to that component for processing",,
FOIA-2011-01205,OAG,5/23/12,"Records from June 8, 2009 to April 26, 2011 pertaining to the shooting of Trey Joyner",Partial Grant/Partial Denial,(b)(5); (b)(6); (b)(7)(C) ,"Certain inter- and intra-agency communications protected by legal privileges; Information the release of which would constitute a clearly unwarranted invasion of the personal privacy of a third party; Records or information compiled for law enforcement purposes, the release of which could reasonably be expected to constitute an unwarranted invasion of the personal privacy of a third party"
FOIA-2011-01206,ODAG,5/23/12,"Records from June 8, 2009 to April 26, 2011 pertaining to the shooting of Trey Joyner",Partial Grant/Partial Denial,(b)(5); (b)(6); (b)(7)(C) ,"Certain inter- and intra-agency communications protected by legal privileges; Information the release of which would constitute a clearly unwarranted invasion of the personal privacy of a third party; Records or information compiled for law enforcement purposes, the release of which could reasonably be expected to constitute an unwarranted invasion of the personal privacy of a third party"
FOIA-2011-01208,PAO,5/23/12,"Records from June 8, 2009 to April 26, 2011 pertaining to the shooting of Trey Joyner",Partial Grant/Partial Denial,(b)(5); (b)(6); (b)(7)(C) ,"Certain inter- and intra-agency communications protected by legal privileges; Information the release of which would constitute a clearly unwarranted invasion of the personal privacy of a third party; Records or information compiled for law enforcement purposes, the release of which could reasonably be expected to constitute an unwarranted invasion of the personal privacy of a third party"
FOIA-2011-01209,OIPL,5/23/12,"Records from June 8, 2009 to April 26, 2011 pertaining to the shooting of Trey Joyner",Partial Grant/Partial Denial,(b)(5); (b)(6); (b)(7)(C) ,"Certain inter- and intra-agency communications protected by legal privileges; Information the release of which would constitute a clearly unwarranted invasion of the personal privacy of a third party; Records or information compiled for law enforcement purposes, the release of which could reasonably be expected to constitute an unwarranted invasion of the personal privacy of a third party"
FOIA-2012-00785,ODAG,5/23/12,Records from the Criminal Division pertaining to requests for Mutual Legal Assistance (MLAT) issued by the Central Authority of Brazil,"Other: Determined that the Criminal Division and Executive Office for United States Attorneys, DOJ, were the most appropriate entities for handling, and referred requester to those components for processing",,
FOIA-2012-00786,OASG,5/23/12,Records from the Criminal Division pertaining to requests for Mutual Legal Assistance (MLAT) issued by the Central Authority of Brazil,"Other: Determined that the Criminal Division and Executive Office for United States Attorneys, DOJ, were the most appropriate entities for handling, and referred requester to those components for processing",,
FOIA-2012-00728,OAG,5/23/12,Records from the Criminal Division pertaining to requests for Mutual Legal Assistance (MLAT) issued by the Central Authority of Brazil,"Other: Determined that the Criminal Division and Executive Office for United States Attorneys, DOJ, were the most appropriate entities for handling, and referred requester to those components for processing",,
FOIA-2012-00894,OLP,5/23/12,Oaths of Office for U.S. District Court Judge Lawrence J. O'Neill and three Assistant U.S. Attorneys,"Partial Grant/Partial Denial/Partial Referral: Determined that the Executive Office for United States Attorneys would be an appropriate entity for handling, and referred request and requester to that component for processing",(b)(6),Information the release of which would constitute a clearly unwarranted invasion of the personal privacy of a third party
FOIA-2012-00890,OLP,5/23/12,Oath of Office and Appointment Affidavit for U.S. District Court Judge Frederick J. Kapala,Partial Grant/Partial Denial,(b)(6),Information the release of which would constitute a clearly unwarranted invasion of the personal privacy of a third party
FOIA-2012-00888,OLP,5/23/12,Oath of Office for U.S. District Court Judge John D. Bates,Partial Grant/Partial Denial,(b)(6),Information the release of which would constitute a clearly unwarranted invasion of the personal privacy of a third party
FOIA-2012-00783,ODAG,5/23/12,"Records related to allegations of voter discrimination in the U.S. territory of Guam, as well as records related to a federal lawsuit on this issue","No Records/Partial Other: Determined that the Civil Rights Division, DOJ, would be an appropriate entity for handling, and referred request and requester to that component for processing",,
FOIA-2012-00711,OAG,5/23/12,"Records related to allegations of voter discrimination in the U.S. territory of Guam, as well as records related to a federal lawsuit on this issue","No Records/Partial Other: Determined that the Civil Rights Division, DOJ, would be an appropriate entity for handling, and referred request and requester to that component for processing",,
FOIA-2012-00784,OASG,5/23/12,"Records related to allegations of voter discrimination in the U.S. territory of Guam, as well as records related to a federal lawsuit on this issue","No Records/Partial Other: Determined that the Civil Rights Division, DOJ, would be an appropriate entity for handling, and referred request and requester to that component for processing",,
FOIA-2012-00884,OIP,5/24/12,Information regarding the certification guidelines of the prisoner grievance program for the New York State Department of Correctional Community Supervision,Duplicate Request,,
FOIA-2012-00834,OASG,5/24/12,Public Corruption in Harrisburg Pennsylvania,"All records referred to the Executive Office for United States Attorneys, DOJ, for processing and direct response to requester",,
FOIA-2011-00387,ODAG,5/25/12,"Records created on or after January 1, 2006 pertaining to certain surveillance capabilities of the Department of Justice","Partial Denial/Partial Referral: Documents referred to the Justice Management Division, DOJ, for processing and direct response to the requester",(b)(5); (b)(6); (b)(7)(C); (b)(7)(E),"Certain inter- and intra-agency communications protected by legal privileges; Information the release of which would constitute a clearly unwarranted invasion of the personal privacy of a third party; Records or information compiled for law enforcement purposes, the release of which could reasonably be expected to constitute an unwarranted invasion of the personal privacy of a third party; Records or information compiled for law enforcement purposes, the release of which would disclose techniques and procedures for law enforcement investigations or prosecutions"
FOIA-2011-00606,OLP,5/25/12,"Records created on or after January 1, 2006 pertaining to certain surveillance capabilities of the Department of Justice",Full Denial,(b)(5); (b)(7)(E),"Certain inter- and intra-agency communications protected by legal privileges; Records or information compiled for law enforcement purposes, the release of which would disclose techniques and procedures for law enforcement investigations or prosecutions"
FOIA-2011-00607,OAG,5/25/12,"Records created on or after January 1, 2006 pertaining to certain surveillance capabilities of the Department of Justice","Partial Denial/Partial Referral: Documents referred to the Justice Management Division, DOJ, for processing and direct response to the requester",(b)(5); (b)(6); (b)(7)(C); (b)(7)(E),"Certain inter- and intra-agency communications protected by legal privileges; Information the release of which would constitute a clearly unwarranted invasion of the personal privacy of a third party; Records or information compiled for law enforcement purposes, the release of which could reasonably be expected to constitute an unwarranted invasion of the personal privacy of a third party; Records or information compiled for law enforcement purposes, the release of which would disclose techniques and procedures for law enforcement investigations or prosecutions"
FOIA-2011-00608,OLP,5/25/12,"Records created on or after January 1, 2006 pertaining to certain surveillance capabilities of the Department of Justice","Partial Denial/Partial Referral: Documents referred to the Justice Management Division, DOJ, for processing and direct response to the requester",(b)(5); (b)(6); (b)(7)(C); (b)(7)(E),"Certain inter- and intra-agency communications protected by legal privileges; Information the release of which would constitute a clearly unwarranted invasion of the personal privacy of a third party; Records or information compiled for law enforcement purposes, the release of which could reasonably be expected to constitute an unwarranted invasion of the personal privacy of a third party; Records or information compiled for law enforcement purposes, the release of which would disclose techniques and procedures for law enforcement investigations or prosecutions"
FOIA-2011-00822,ODAG,5/25/12,"Records created on or after January 1, 2006 pertaining to certain surveillance capabilities of the Department of Justice",Full Denial,(b)(5); (b)(7)(E),"Certain inter- and intra-agency communications protected by legal privileges; Records or information compiled for law enforcement purposes, the release of which would disclose techniques and procedures for law enforcement investigations or prosecutions"
FOIA-2011-01068,OLA,5/25/12,"Records created on or after January 1, 2006 pertaining to certain surveillance capabilities of the Department of Justice",Full Denial,(b)(5); (b)(7)(E),"Certain inter- and intra-agency communications protected by legal privileges; Records or information compiled for law enforcement purposes, the release of which would disclose techniques and procedures for law enforcement investigations or prosecutions"
FOIA-2012-00664,OIP,5/25/12,"Request letter and correspondence between the Department and the requester, pertaining to the FOIA request submitted to this Office on February 1, 2008, as listed in the “10 Oldest Pending Perfected FOIA Requests” in the 2011 Annual FOIA Report",Partial Grant/Partial Denial,(b)(6),Information the release of which would constitute a clearly unwarranted invasion of the personal privacy of a third party
FOIA-2012-00954,OIP,5/29/12,"Information on whether certain New York State penal law sections were certified as constitutional by the U.S. Supreme Court, and copies of bonds created by a New York state court","Other: Informed requester that the FOIA does not apply to Judicial Branch records, that it does not require research, and directed requester to the local branch of the New York State court system",,
FOIA-2011-00273,OAG,5/29/12,"""Records Relating to the Post-September 11, 2001 Transfer Policies and Practices of the United States""",Full Grant,,
FOIA-2012-00851,OIP,5/29/12,Copies of opinions in four Supreme Court cases and two Missouri cases,Partial Grant/Partial Other: Provided publicly available Supreme Court materials and that requester did not provide enough information to locate Missouri cases,,
FOIA-2012-00950,OIP,5/29/12,"Information that ""evidence[s] the authority"" of the United States Attorney General or the Department of Justice to represent the Internal Revenue Service (IRS) in civil or criminal matters and ""evidence the IRS is an agency of the United States government""","Provided requester with copies of DOJ and Dep't of Treasury regulations, as well as information from DOJ and IRS websites",,
FOIA-2012-00843,OAG,5/30/12,Information regarding the Atrocities Prevention Board,No Records,,
FOIA-2012-00804,OIP,5/30/12,Records concerning various Department of Justice re-entry programs for ex-offenders.,"Other: Determined that the Bureau of Justice Programs, Office of Justice Programs, DOJ, was the most appropriate entity for handling and referred requester to that component for processing",,
FOIA-2012-00813,OIP,5/30/12,"Copies of the OIP organization, mission, and functions manual; DOJ component directory; FOIA officer directory; and a catalog of publicly available information","Provided requester with copies of the DOJ FOIA Reference Guide, DOJ publications list, and a copy of Your Right to Federal Records",,
FOIA-2012-00679,OIP,5/30/12,Copy of the U.S.A. PATRIOT Act,Full Grant,,
FOIA-2012-00893,OIP,5/30/12,Assistance on civil rights matter in the State of Minnesota,"Other: Determined that the Civil Rights Division, DOJ, was the most appropriate entity for handling and referred requester to that component for processing",,
FOIA-2012-00963,OIP,5/30/12,Information regarding the certification guidelines of the prisoner grievance program for the New York State Department of Correctional Community Supervision,"Provided requester with publicly available information and informed requester that the Civil Rights Division, DOJ, might have additional information on this topic, and directed requester to that component",,
FOIA-2010-00545,ODAG,5/30/12,"Records of communications related to the July 28, 2009 press conference at Philadelphia City Hall, attended by the Attorney General, the Vice President and others, regarding the announcement of COPS Grant Awards",Full Grant,,
FOIA-2012-00845,OIP,5/30/12,Information on the FOIA and its applicability to local governments,Provided requester with DOJ FOIA Reference Guide and informed requester that the FOIA does not apply to state or local records,,
FOIA-2012-00952,OIP,5/30/12,Information about making a FOIA request and FOIA contact information,Provided requester with DOJ FOIA Reference Guide and provided FOIA contact information from FOIA.gov,,
FOIA-2012-00891,OIP,5/31/12,Asking a series of questions,Other: Informed requester that the FOIA is a records access statute and is not applicable to this query,,
FOIA-2012-00895,OIP,5/31/12,"Unspecified information regarding government grants, entitlements, programs and foundations",Provided DOJ Reference Guide to help requester refine request and determine appropriate components that would have records or information sought,,
FOIA-2010-00074,OAG,5/31/12,"Records pertaining to former Black Panther Party member Veronza Bowers, as well as the re-authorization information for the U.S. Parole Commission",Other: Documents referred by office originally processing the request were determined to be improperly directed to OIP and were sent back to office originally processing request.  Additional documents were determined to be not responsive to the request after review by OIP,,
FOIA-2012-00956,OLP,5/31/12,"Copy of the Oath of Office for U.S. District Court Judge Michael J. Reagan, as well as various U.S. Attorneys, U.S. Marshals and unnamed FBI, DEA, and ATF agents","No Records/Partial Other: Determined that the FBI, DEA, ATF, and Executive Office for United States Attorneys, DOJ, were also appropriate entities for handling, and referred request and requester to those components for processing",,
FOIA-2012-00964,OLP,5/31/12,"Copies of the Oath of Office, Appointment Affidavit, Presidential and Senate Commissions and Official Bond for U.S. District Court Judge F. Dennis Saylor, IV","Partial Grant/Partial Denial/Partial No Records: Informed requester that federal judges are not bonded, and as such, no records exist for this aspect of the request",(b)(6),Information the release of which would constitute a clearly unwarranted invasion of the personal privacy of a third party
FOIA-2012-00841,OIP,5/31/12,"Information on how and where to file a criminal complaint, as well as information on the Office of the Inspector General",Other: Provided requester with publicly available information from the DOJ website ,,
