Request Number,Office,Date Closed,Summary of Request,Disposition of Request,Exemption(s) Applied (if applicable),Description of Exemption(s) (if applicable)
FOIA-2014-02583,ODAG,9/29/14,Training materials pertaining to FOIA,Full Grant,,
FOIA-2014-03924,ODAG,9/29/14,"Privacy impact assessments submitted by the Federal Bureau of Investigation regarding its use of unmanned aerial vehicles (UAV), unmanned aerial systems (UAS) or ""drones,"" as well as materials pertaining to the assessments in question",No Records,,
FOIA-2014-03933,OIP,9/29/14,Records pertaining to the Riverside Police Officers' Association,Determined that records were improperly referred and forwarded records back to U.S. Postal Inspector Service for further review,,
FOIA-2014-04674,OIP,9/29/14,NCIS Summary of Investigation Findings,Determined that records were improperly referred and forwarded records back to NCIS for further review,,
FOIA-2010-00360,OAG,9/30/14,"Records pertaining to regulations, policies, and guidelines governing the assertion of the state secrets privilege by the Attorney General, or his designee, in ongoing federal cases",Partial Grant/Partial Denial,(b)(5); (b)(6); (b)(7)(C) ,"Certain inter- and intra-agency communications protected by legal privileges; Information the release of which would constitute a clearly unwarranted invasion of the personal privacy of a third party; Records or information compiled for law enforcement purposes, the release of which could reasonably be expected to constitute an unwarranted invasion of the personal privacy of a third party"
FOIA-2011-00006,ODAG,9/30/14,Records of communications between DOJ and the White House (or Executive Office of the President) concerning the case U.S. v. New Black Panther Party for Self Defense from 5/15/09 - 9/28/10,Partial Grant/Partial Denial,(b)(5); (b)(6),Certain inter- and intra-agency communications protected by legal privileges; Information the release of which would constitute a clearly unwarranted invasion of the personal privacy of a third party 
FOIA-2012-00455,OIP,9/30/14,Records between the Office of Information Policy and other agencies concerning metadata in regard to FOIA,Partial Grant/Partial Denial,(b)(5); (b)(6),Certain inter- and intra-agency communications protected by legal privileges; Information the release of which would constitute a clearly unwarranted invasion of the personal privacy of a third party 
FOIA-2012-01163,OIP,9/30/14,"Records referencing FOIA and Privacy Act requests submitted by specific identified parties, that contain ""remarks, comments, notes, explanation, etc."" made by DOJ personnel about the processing of such requests",Full Grant,,
FOIA-2012-01383,OAG,9/30/14,Certain records concerning a DOJ investigation into allegations against Bank of America,Full Grant,,
FOIA-2012-01384,ODAG,9/30/14,Certain records concerning a DOJ investigation into allegations against Bank of America,Full Grant,,
FOIA-2012-01479,OAG,9/30/14,"Communications from January 20, 2009 between any Office of Legal Counsel (OLC) official and Dawn Johnsen regarding various personnel matters for career and non-career OLC officials",Partial Grant/Partial Denial of referred records,(b)(5); (b)(6),Certain inter- and intra-agency communications protected by legal privileges; Information the release of which would constitute a clearly unwarranted invasion of the personal privacy of a third party 
FOIA-2012-01480,ODAG,9/30/14,"Communications from January 20, 2009 between any Office of Legal Counsel (OLC) official and Dawn Johnsen regarding various personnel matters for career and non-career OLC officials",Partial Grant/Partial Denial of referred records,(b)(5); (b)(6),Certain inter- and intra-agency communications protected by legal privileges; Information the release of which would constitute a clearly unwarranted invasion of the personal privacy of a third party 
FOIA-2012-01481,OAG,9/30/14,Communications from January 2009 between any Office of Legal Counsel (OLC) official and Dawn Johnsen regarding various personnel matters for career and non-career OLC officials,Partial Grant/Partial Denial of referred records,(b)(5); (b)(6),Certain inter- and intra-agency communications protected by legal privileges; Information the release of which would constitute a clearly unwarranted invasion of the personal privacy of a third party 
FOIA-2012-01482,ODAG,9/30/14,Communications from January 2009 between any Office of Legal Counsel (OLC) official and Dawn Johnsen regarding various personnel matters for career and non-career OLC officials,Partial Grant/Partial Denial of referred records,(b)(5); (b)(6),Certain inter- and intra-agency communications protected by legal privileges; Information the release of which would constitute a clearly unwarranted invasion of the personal privacy of a third party 
FOIA-2013-02895,ODAG,9/30/14,Records pertaining to eGuardian,"Determined that records were improperly referred and forwarded records to FBI, JMD, and OJP for further review",,
FOIA-2013-03706,OIP,9/30/14,"Logs of all open FOIA, Privacy Act, Presidential Records Act, and Mandatory Declassification Review requests pending in OIP",Partial Grant/Partial Denial,(b)(6),Information the release of which would constitute a clearly unwarranted invasion of the personal privacy of a third party
FOIA-2013-04379,OIP,9/30/14,The Office of Information Policy administrative appeal log  since January 2011,Partial Grant/Partial Denial,(b)(6); (b)(7)(C) ,"Information the release of which would constitute a clearly unwarranted invasion of the personal privacy of a third party; Records or information compiled for law enforcement purposes, the release of which could reasonably be expected to constitute an unwarranted invasion of the personal privacy of a third party"
FOIA-2013-04990,OIP,9/30/14,The Office of Information Policy administrative appeal log  from 2011-2013,Partial Grant/Partial Denial,(b)(6); (b)(7)(C) ,"Information the release of which would constitute a clearly unwarranted invasion of the personal privacy of a third party; Records or information compiled for law enforcement purposes, the release of which could reasonably be expected to constitute an unwarranted invasion of the personal privacy of a third party"
FOIA-2014-00284,OIP,9/30/14,The Office of Information Policy administrative appeal log  since 2011,Partial Grant/Partial Denial,(b)(6); (b)(7)(C) ,"Information the release of which would constitute a clearly unwarranted invasion of the personal privacy of a third party; Records or information compiled for law enforcement purposes, the release of which could reasonably be expected to constitute an unwarranted invasion of the personal privacy of a third party"
FOIA-2014-00320,OIP,9/30/14,"The Office of Information Policy administrative appeal log since January 1, 2011",Partial Grant/Partial Denial,(b)(6); (b)(7)(C) ,"Information the release of which would constitute a clearly unwarranted invasion of the personal privacy of a third party; Records or information compiled for law enforcement purposes, the release of which could reasonably be expected to constitute an unwarranted invasion of the personal privacy of a third party"
FOIA-2014-00329,OIP,9/30/14,The Office of Information Policy administrative appeal log  from 2011-2013,Partial Grant/Partial Denial,(b)(6); (b)(7)(C) ,"Information the release of which would constitute a clearly unwarranted invasion of the personal privacy of a third party; Records or information compiled for law enforcement purposes, the release of which could reasonably be expected to constitute an unwarranted invasion of the personal privacy of a third party"
FOIA-2014-02557,ODAG,9/30/14,"Records dating since 2005 concerning the Deferred Prosecution Agreement reached in 2007 between the Department of Justice and Zimmer Holdings, in the Offices of the Attorney General, Deputy Attorney General, Legislative Affairs, and Public Affairs",No Records,,
FOIA-2014-02588,OLA,9/30/14,"Correspondence to the U.S. House of Representatives and Senate Committees on Homeland Security & Governmental Affairs and to various named members of Congress, from April 2013 to the present",Full Grant of referred records,,
FOIA-2014-03392,OLA,9/30/14,"Questions for the Record submitted since January 1, 2014, and their corresponding answers",Partial Grant/Partial No Records,,
FOIA-2014-03539,OAG,9/30/14,Copy of Attorney General Order No. 3168-2010,Full Grant,,
FOIA-2014-04087,ODAG,9/30/14,Records pertaining to Office of Privacy and Civil Liberties (OPCL) appeals,Full Grant,,
FOIA-2014-04420,OLA,9/30/14,Copy of the Department of Justice's Third Quarter Fiscal Year (FY 2014) Uniformed Services Employment and Reemployment Rights Act of 1994 (USERRA),Full Grant,,
FOIA-2014-04653,OIP,9/30/14,Records pertaining to a third party,"Referred requester and/or request to more appropriate entity (FBI, DEA)",,
FOIA-2014-04662,OIP,9/30/14,The personnel file of former Assistant United States Attorney David Patrick Vaughn,Referred requester and/or request to more appropriate entity (EOUSA),,
FOIA-2014-04666,OIP,9/30/14,Copy of the names of 13 FBI agents who worked in the Hair and Fiber Section of the FBI lab associated with an Office of the Inspector General Report dated July 2014,Full Grant of publicly available material,,
FOIA-2014-04672,OIP,9/30/14,Information pertaining to a federal court case,Referred requester and/or request to more appropriate entity (EOUSA),,
FOIA-2014-04678,OIP,9/30/14,"Copy of a 1953 directive from Federal Bureau of Investigation (FBI) Director J. Edgar Hoover to FBI field offices to investigate communist subversion and other potential security risks in colleges and universities, and other records",Referred requester and/or request to more appropriate entity (FBI),,
FOIA-2014-04768,OIP,9/30/14,Federal Bureau of Investigation records pertaining to the late philosopher Bertrand Russell,Referred requester and/or request to more appropriate entity (FBI),,
FOIA-2014-04871,OIP,9/30/14,Records pertaining to a third party,"Referred requester and/or request to more appropriate entity (FBI, NARA)",,
FOIA-2014-04872,OIP,9/30/14,Records pertaining to John Howard Lawson (deceased),"Referred requester and/or request to more appropriate entity (FBI, NARA)",,
FOIA-2014-04924,OIP,9/30/14,Immigration records pertaining to a third party,Referred requester and/or request to more appropriate entity (USCIS),,
FOIA-2014-04943,OIP,9/30/14,Records concerning an unspecified event,Provided relevant information and assistance,,
