Request Number,Office,Submitted Date,Date Closed,Summary of Request,Disposition of Request
DOJ-2016-000505,OIP,3/10/2016,3/31/2016,Requesting copy of the Department of Justice Freedom of Information Act Reference Guide.,Full grant
DOJ-2016-000316,OIP,3/3/2016,3/15/2016,"Federal FOIA contacts, samples of FOIA and appeal requests,records maintained by various agencies, and copy of study on the effects of solitary confinement.",Partial grant/partial denial
DOJ-2016-000359,OIP,3/2/2016,3/15/2016,Copy of the 9/11 Commission Report.,Full grant
DOJ-2016-000025,OIP,2/20/2016,3/7/2016,"All records produced or received by the State Department relating to a “blue notice” issued by INTERPOL regarding the former intelligence operations chief of Argentina’s spy service, Antonio Horacio Stiuso",Improper FOIA request for other reason
DOJ-2016-000019,OIP,2/19/2016,3/9/2016,"Department of Justice, Office of the Attorney General and Office of Information Policy “FOIA Logs” detailing FOIA requests made between January 1, 2015, and February 14, 2016.",Full grant
DOJ-2016-000114,OIP,2/19/2016,3/7/2016,Copy of former Attorney General Eric Holder’s 2013 policy memorandum on mandatory minimum sentences.,Full grant
DOJ-2016-000113,OIP,2/18/2016,3/4/2016,Copy of former Attorney General Eric Holder’s 2013 policy memorandum on mandatory minimum sentences.,Full grant
DOJ-2016-000152,OLP,2/17/2016,3/17/2016,Nomination files for United States Appeals Court Judges Sri Srinivasan and Paul J. Watford,Request withdrawn
DOJ-2016-000046,OIP,2/10/2016,3/8/2016,Seeking legal assistance.,Improper FOIA request for other reason
DOJ-2016-000916,OLP,1/19/2016,3/11/2016,Records concerning John Kasich.,No records
DOJ-2016-000917,OAG,1/15/2016,3/7/2016,Communication between the Department of Justice and Fannie Mae regarding a private address.,No records
DOJ-2016-000893,OIP,12/30/2015,3/25/2016,Records related to a FOIA request submitted by Freedom of the Press Foundation.,Partial grant/partial denial
DOJ-2016-000751,OIP,11/16/2015,3/17/2016,"Correspondence between both Amnesty International and Amnesty International USA and the Office of Information Policy from January 1, 2001 to December 31, 2013.",Full grant
DOJ-2016-000688,OAG,11/2/2015,3/23/2016,"Correspondence (including email) between the Office of U.S. Senator Marco Rubio and the Department of the Interior from January 3, 2011, to the present.",Request withdrawn
DOJ-2016-000717,ODAG,11/2/2015,3/14/2016,Correspondence from the Department of Justice to a Congressional Committee or Committee Chair in calendar years since 2014.,Duplicate request
DOJ-2016-000716,ODAG,11/2/2015,3/14/2016,Correspondence from the Department of Justice to a Congressional Committee or Committee Chair in calendar years since 2014.,Full grant
DOJ-2016-000711,OLA,11/2/2015,3/23/2016,"Correspondence (including email) between the Office of U.S. Senator Marco Rubio and the Department of the Interior from January 3, 2011, to the present.",Request withdrawn
DOJ-2016-000709,ODAG,11/2/2015,3/23/2016,"Correspondence (including email) between the Office of U.S. Senator Marco Rubio and the Department of the Interior from January 3, 2011, to the present.",Request withdrawn
DOJ-2016-000686,ODAG,10/30/2015,3/2/2016,Records concerning Karen Gay Silkwood.,Full grant
DOJ-2016-000581,ODAG,10/2/2015,3/17/2016,Records concerning the Executive Office of Immigration Review's Hardware Failure,Full grant
DOJ-2015-000378,OIP,9/17/2015,3/31/2016,Records concerning the Department Review Committee.,Full grant
DOJ-2015-000182,OLA,3/6/2015,3/31/2016,"Records concerning John Ellis ""Jeb"" Bush.",Request withdrawn
DOJ-2015-000152,OAG,3/6/2015,3/31/2016,"Records concerning John Ellis ""Jeb"" Bush.",Request withdrawn
DOJ-2015-000173,OLA,3/5/2015,3/25/2016,"Records concenring communications between the Department of Justice and Sen. Sessions, his personal staff, or his committee staff regarding the FOIA.",Partial grant/partial denial
DOJ-2015-000143,OIP,3/5/2015,3/25/2016,"Records concenring communications between the Department of Justice and Sen. Sessions, his personal staff, or his committee staff regarding the FOIA.",Partial grant/partial denial
DOJ-2015-000148,OAG,3/4/2015,3/17/2016,"Attorney General memorandum to all federal prosecutors dated July 15, 2011.",Full grant
DOJ-2015-000121,ODAG,2/12/2015,3/1/2016,All privacy impact assessments submitted by the Drug Enforcement Adminsitration regarding its use of automatic license plate readers.,No records
DOJ-2015-000131,OIP,2/5/2015,3/17/2016,Records concerning the Massachusetts Joint Terrorism Task Force.,Other - Referred Documents not Responsive
DOJ-2015-000082,OLA,1/20/2015,3/17/2016,Communications between the Department of Justice and Senator Jim Webb since 2006.,Request withdrawn
DOJ-2015-000073,OLA,1/16/2015,3/17/2016,Communications between the Department of Justice and Senator Marco Rubio since 2010.,Request withdrawn
DOJ-2015-000051,OAG,11/26/2014,3/30/2016,Communications concerning Quinn Emanuel Urquhart and Sullivan LLP.,No records
DOJ-2015-000054,OLA,11/26/2014,3/31/2016,Communications concerning Quinn Emanuel Urquhart and Sullivan LLP.,No records
DOJ-2015-000053,OASG,11/26/2014,3/31/2016,Communications concerning Quinn Emanuel Urquhart and Sullivan LLP.,No records
DOJ-2015-000052,ODAG,11/26/2014,3/30/2016,Communications concerning Quinn Emanuel Urquhart and Sullivan LLP.,No records
DOJ-2014-000177,OIP,7/30/2014,3/25/2016,"Emails between Melanie Pustay, Carmen Mallon, Senator John Cornyn, and Senator Patrick Leahy between Jan 1, 2014, and June 21, 2014.",Partial grant/partial denial
DOJ-2014-000178,OLA,7/30/2014,3/25/2016,"Emails between Melanie Pustay, Carmen Mallon, Senator John Cornyn, and Senator Patrick Leahy between Jan 1, 2014, and June 21, 2014.",Partial grant/partial denial
DOJ-2014-000169,OAG,7/25/2014,3/8/2016,"Records concerning the documentaries ""2016: Obama's America"" and/or ""America: Imagine a World Without Her"" from January 1, 2012, to May 21, 2014.",No records
DOJ-2014-000170,ODAG,7/25/2014,3/8/2016,"Records concerning the documentaries ""2016: Obama's America"" and/or ""America: Imagine a World Without Her"" from January 1, 2012, to May 21, 2014.",No records
DOJ-2014-000087,OAG,3/11/2014,3/10/2016,Records concerning Fiscal Year 13 and 14 federal budget sequestration.,Request withdrawn
DOJ-2014-000063,ODAG,11/22/2013,3/21/2016,Records concerning Project Gunrunner.,Partial grant/partial denial
DOJ-2014-000065,OLA,11/22/2013,3/21/2016,Records concerning Project Gunrunner.,Partial grant/partial denial
DOJ-2014-000064,PAO,11/22/2013,3/21/2016,Records concerning Project Gunrunner.,Partial grant/partial denial
DOJ-2014-000027,OIP,11/5/2013,3/28/2016,"200 pages of emails received by Melanie Pustay that contain FOIA between July 1, 2012 and November 1, 2012",Partial grant/partial denial
DOJ-2014-000024,OIP,11/4/2013,3/28/2016,"200 pages of emails received by Melanie Pustay that contain FOIA between July 1, 2012 and November 1, 2012",Partial grant/partial denial
DOJ-2014-000025,OIP,11/4/2013,3/28/2016,"200 pages of emails received by Melanie Pustay that contain FOIA between July 1, 2012 and November 1, 2012",Partial grant/partial denial
DOJ-2014-000003,OIP,10/17/2013,3/28/2016,"Copies of the first 200 pages of emails received by Melanie Ann Pustay that contain the word ""FOIA""  between July 1, 2012, and November 1, 2012. ",Partial grant/partial denial
DOJ-2013-000124,OIP,9/4/2013,3/28/2016,"Copies of the first 200 pages of emails received by Melanie Ann Pustay that contain the word ""FOIA""  between July 1, 2012, and November 1, 2012. ",Partial grant/partial denial
DOJ-2013-000118,ODAG,8/2/2013,3/29/2016,"Emails to and from Deputy Attorney General James Cole between December 1, 2012, and August 1, 2013, regarding the legalization of recreational marijuana in the states of Washington and Colorado.",Partial grant/partial denial
DOJ-2013-000110,OAG,7/24/2013,3/14/2016,Communications to or from Attorney General Eric Holder regarding the subpoena for the phone records of Fox News reporter James Rosen.,No records
DOJ-2012-000042,OLA,6/21/2012,3/7/2016,"Emails between the Office of Legislative Affairs and Rep. John Boehner's office from May 1, 2011, to present.",Partial grant/partial denial
DOJ-2012-000016,OLA,1/4/2012,3/3/2016,Communications between the Department of Justice and the White House/Executive Office of the President concerning the Department's propsed rule to revise  regulations under FOIA.,Partial grant/partial denial
DOJ-2012-000012,ODAG,12/5/2011,3/21/2016,Records concerning Project Gunrunner.,Partial grant/partial denial
DOJ-2012-000002,OAG,10/26/2011,3/16/2016,Records concerning insurance claims by Holocaust survivors.,Full grant
DOJ-2012-000003,ODAG,10/26/2011,3/16/2016,Records concerning insurance claims by Holocaust survivors.,Full grant
DOJ-2011-000043,OAG,8/1/2011,3/7/2016,"Records concerning the recovered weapons involved in violent crimes in the United States, affiliated with the Operation Fast and Furious.",Partial grant/partial denial
DOJ-2011-000038,OAG,7/20/2011,3/17/2016,"Correspondence between officials of the Office of the Attorney General, the Office of the Deputy Attorney General, the Office of the Associate Attorney General, or the Office of Public Affairs concerning the News of the World, News Corporation CEO Rupert Murdoch, or the News of the World phone hacking scandal.",Full grant
DOJ-2011-000037,OAG,7/7/2011,3/3/2016,Records concerning the Department of Justice's  efforts to acquire one or more of the drugs used to execute condemned prisoners by lethal injection.,Partial grant/partial denial
DOJ-2011-000031,OAG,6/15/2011,3/4/2016,Records concerning a conference call between the Department of Justice and multiple state Attorneys General pertaining to the states acquisition or use of sodium thiopental in their lethal-injection protocols.,Partial grant/partial denial
DOJ-2011-000027,OAG,5/31/2011,3/16/2016,Memoranda explicating the meaning of provisions of the USA PATRIOT Act.,Full grant
DOJ-2011-000014,OAG,4/13/2011,3/21/2016,"Communications from February 1, 2011, to present referring to a named CBS News correspondent and/or a named CBS News producer.",Partial grant/partial denial
DOJ-2011-000018,ODAG,4/13/2011,3/21/2016,Communications concerning the December 2010 death and/or investigation into the death of Agent Brian Terry.,Partial grant/partial denial
DOJ-2011-000017,OAG,4/13/2011,3/21/2016,Communications concerning the December 2010 death and/or investigation into the death of Agent Brian Terry.,Partial grant/partial denial
DOJ-2011-000016,OAG,4/13/2011,3/21/2016,"Communications concerning Project Gunrunner from January 1, 2010, to present.",Partial grant/partial denial
DOJ-2011-000015,ODAG,4/13/2011,3/21/2016,"Communications from February 1, 2011, to present referring to a named CBS News correspondent and/or a named CBS News producer.",Partial grant/partial denial
DOJ-2011-000002,OAG,4/11/2011,3/10/2016,Records concerning an Office of Professional Responsibilty investigation of Wen Ho Lee.,Other - Referred records improperly directed
DOJ-2011-000012,OAG,4/4/2011,3/17/2016,"Communications between the Office of the Attorney General, Office of the Deputy Attorney General and the Office of Public Affairs regarding Freedom of Information Act requests since January 1, 2009.",Partial grant/partial denial
DOJ-2011-000013,ODAG,4/4/2011,3/17/2016,"Communications between the Office of the Attorney General, Office of the Deputy Attorney General and the Office of Public Affairs regarding Freedom of Information Act requests since January 1, 2009.",Partial grant/partial denial
DOJ-2011-000005,OAG,1/5/2011,3/11/2016,"Communications between the Office of the Attorney General, Office of the Deputy Attorney General and the Office of Public Affairs regarding Freedom of Information Act requests since January 1, 2009.",Partial grant/partial denial
