Request Number,Office,Date Closed,Summary of Request,Disposition of Request,Exemption(s) Applied (if applicable),Description of Exemption(s) (if applicable)
FOIA-2011-01207,OLA,6/29/12,"Records from June 8, 2009 to April 26, 2011 pertaining to the fatal shooting of Trey Joyner",Partial Grant/Partial Denial,(b)(3); (b)(7)(C); (b)(7)(D),"Information that is prohibited from disclosure by another federal law;  Records or information compiled for law enforcement purposes, the release of which could reasonably be expected to constitute an unwarranted invasion of the personal privacy of a third party; Records or information compiled for law enforcement purposes, the release of which could reasonably be expected to disclose the identity of a confidential source"
FOIA-2012-00122,OLA,6/29/12,"Copies of certain letters from members of Congress between January 1, 2005, and October 1, 2011, that mention Koch Industries and David Koch and Charles Koch","All records referred to the Criminal Division, DOJ, for processing and direct response to the requester",,
FOIA-2012-00601,ODAG,6/29/12,Memorandum from Deputy Attorney General James Cole regarding early disposition programs,Full Grant,,
FOIA-2012-01021,OIP,6/29/12,"Name of the Union President of the Bureau of Prisons, as well as contact information for the Inspector General",Provided name and requested contact information,,
FOIA-2012-01042,OIP,6/29/12,Records pertaining to a file from the Transportation Security Administration,Other: Determined that that records referred to this office for processing were misdirected and referred documents back to originating agency to continue processing,,
