Request Number,Office,Date Closed,Summary of Request,Disposition of Request,Exemption(s) Applied (if applicable),Description of Exemption(s) (if applicable),
FOIA-2013-04692,OAG,8/19/13,"Records pertaining to a court case in the possession of the United States Attorney’s Office for the Western District of Texas, Midland-Odessa Division",Full Grant,,,
FOIA-2013-02121,OAG,8/20/13,Unclassified records pertaining to Brian Regan,Documents referred by the office originally processing the request were determined to be not responsive to the request after review by OIP,,,
FOIA-2013-03861,OAG,8/20/13,"Report received by the Congressional intelligence committees from the Attorney General on February 2, 2011, pertaining to intelligence collection activities that were subject to expiration under Section 224 of the USA PATRIOT Act",Partial Grant/Partial Denial,(b)(1); (b)(3),Information that is classified by Executive Order to protect national security; Information that is prohibited from disclosure by another federal law,
FOIA-2013-04730,OIP,8/20/13,Copy of a FOIA request letter submitted to the Executive Office for United States Attorneys,Determined that the Executive Office for United States Attorneys was an appropriate entity for handling and referred request and requester to that component for processing,,,
FOIA-2012-01285,OIP,8/21/13,"Copy of the administrative appeal logs from January 1, 2011 to August 1, 2012",Request withdrawn for fee related reasons,,,
FOIA-2013-01869,OIP,8/21/13,"Copies of the first 100 pages of e-mails sent to received  by the Director of the DOJ's Office of Information Policy, Melanie Ann Pustay, that contain the word ""FOIA"" from July 1, 2012 to November 1, 2012",Request withdrawn for fee related reasons,,,
FOIA-2013-04194,OIP,8/21/13,"Cables, memoranda, and travel manifests or other records of trips to and from Brazil by Department of Justice personnel during January 1973",Provided requester with DOJ FOIA Reference Guide to help determine the DOJ component most likely to maintain the records sought,,,
FOIA-2013-04313,OIP,8/21/13,Records regarding the Brazilian death squad Grupo de Operacoes Especiais from 1964 to 1985,"Determined that the FBI, CIA, and the Department of State were the most appropriate entities for handling and referred requester to those entities for processing",,,
FOIA-2013-04314,OIP,8/21/13,Records regarding Grupo de Operacoes Especiais,"Determined that the FBI, CIA, and the Department of State were the most appropriate entities for handling and referred requester to those entities for processing",,,
FOIA-2013-04470,OIP,8/21/13,"An abstract referenced in an August 8, 1951 letter from then-Attorney General J. Howard McGrath to then-Army Secretary Frank Pace concerning U.S. Army Corps of Engineers tracts of land in Tarrant County, Texas",Determined that the U.S. Army Corps of Engineers and the Truman Presidential Library were the most appropriate entities for handling and referred requester to those entities for processing,,,
FOIA-2013-04486,OIP,8/21/13,Records regarding Esquadrao da Morte,"Determined that the FBI, CIA, and the Department of State were the most appropriate entities for handling and referred requester to those entities for processing",,,
FOIA-2013-04487,OIP,8/21/13,Records regarding Scuderie Le Cocq,"Determined that the FBI, CIA, and the Department of State were the most appropriate entities for handling and referred requester to those entities for processing",,,
FOIA-2013-04488,OIP,8/21/13,Records regarding Operacao Limpeza,"Determined that the FBI, CIA, and the Department of State were the most appropriate entities for handling and referred requester to those entities for processing",,,
FOIA-2013-04602,OAG,8/21/13,Correspondence between the United States Department of Justice and Dinesh Thakur,No Records,,,
FOIA-2013-04603,OAG,8/21/13,Correspondence between the United States Department of Justice and an identified third party,No Records,,,
FOIA-2013-04604,OAG,8/21/13,Correspondence between the United States Department of Justice and Rajendra (or Rajinder) Kumar,No Records,,,
FOIA-2013-04716,ODAG,8/21/13,Correspondence between the United States Department of Justice and Rajendra (or Rajinder) Kumar,No Records,,,
FOIA-2013-04717,OASG,8/21/13,Correspondence between the United States Department of Justice and Rajendra (or Rajinder) Kumar,No Records,,,
FOIA-2013-04718,ODAG,8/21/13,Correspondence between the United States Department of Justice and an identified third party,No Records,,,
FOIA-2013-04719,OASG,8/21/13,Correspondence between the United States Department of Justice and an identified third party,No Records,,,
FOIA-2013-04720,ODAG,8/21/13,Correspondence between the United States Department of Justice and Dinesh Thakur,No Records,,,
FOIA-2013-04721,OASG,8/21/13,Correspondence between the United States Department of Justice and Dinesh Thakur,No Records,,,
FOIA-2012-01091,OLA,8/22/13,"All letters, phone records or other communications from members of Congress seeking to designate spending by the Department of Justice (including all departments, bureaus and sub-agencies) in a manner beyond the normal budget and appropriations process since January",No Records,,,
FOIA-2013-04598,OAG,8/22/13,The electronic address designated to present the Attorney General with a constitutional question arising from a civil procedure taking place in the United States,Informed requester that the FOIA is a records access statute and not applicable to this query; Provided requester with link to the DOJ Action Center,,,
FOIA-2013-04700,OIP,8/22/13,Certain correspondence between past or present Solicitors General and United States Attorneys or Assistant United States Attorneys concerning the McKittrick Policy,"Determined that the Executive Office for United States Attorneys and the Office of the Solicitor General, DOJ, were appropriate entities for handling and referred request and requester to those components for processing",,,
FOIA-2013-04707,OAG,8/22/13,"Memorandum to United States Attorneys from Attorney General Holder regarding new guidelines for determining when federal charges should be filed, with a focus on targeting “the most serious offenses” and “the most dangerous criminals""",Request withdrawn by requester after being informed that document had been made available online,,,
FOIA-2013-04660,OIP,8/23/13,Information on the Freedom of Information Act and Privacy Act,Provided requester with a copy of the DOJ FOIA Reference Guide and information on requesting records on individuals to assist requester in identifying DOJ components that typically maintain records on individuals.  Also provided requester address to the U.S. Public Health Services Office - part of the Department of Health & Human Services as requester sought FOIA information for this office specifically,,,
FOIA-2013-04661,OIP,8/23/13,Eight FOIA/PA referral action slips from this Office as well as the contact information for the United States Marshals Service (USMS),Partial Grant/Partial No Records,,,
FOIA-2013-04709,OLP,8/23/13,"Records regarding the United States government's interest in, findings on, or investigations into Intuitive Surgical, Inc.",No Records,,,
FOIA-2013-04798,OIP,8/23/13,Records pertaining to a court case,Provided requester with DOJ FOIA Reference Guide and information on requesting records on individuals to assist requester in identifying DOJ components that typically maintain records on individuals,,,
FOIA-2013-04440,OIP,8/26/13,"(1) Communications related to the establishment of a national hotline to collect tips regarding the fatal shooting of Trayvon Martin; (2) Communications sent or received via that hotline, (3) FOIA requests and media inquiries regarding the tip line",Partial Grant/Partial Denial,(b)(6),Information the release of which would constitute a clearly unwarranted invasion of the personal privacy of a third party ,
FOIA-2013-04627,OIP,8/26/13,Copy of Executive Order 11154,Determined that the National Archives and Records Administration  was the most appropriate entity for handling and referred requester to that agency for processing,,,
FOIA-2013-04644,OIP,8/26/13,"AccessAbility Incorporated's (of Minneapolis, Minnesota, Hoover Street N.E.) WH-226A Form (labor form) for the time period of August 1, 2011 to August1, 2013 along with its Disability Code List ",Determined that the Department of Labor was the most appropriate entity for handling and referred requester to that agency for processing,,,
FOIA-2013-04724,OLA,8/26/13,Records pertaining to former Congressman Roscoe G. Bartlett,Duplicate Request: Documents were referred by another entity in response to a request already being processed by OIP; Referred documents were incorporated into ongoing processing under original OIP tracking number,,,
FOIA-2013-04749,OIP,8/26/13,"Records pertaining to ""Background Investigation(s)""",Determined that the Office of Personnel Management was the most appropriate entity for handling and referred requester to that agency for processing,,,
FOIA-2013-00415,OIP,8/27/13,Contents of an FBI file,"Determined that records were improperly referred to OIP for processing and forwarded records to the Criminal Division, DOJ, for  processing and response to the requester",,,
FOIA-2013-02482,OAG,8/27/13,Formal opinions issued by the Attorney General to the Bureau of Prisons since 2007 with respect to the administration of the FOIA,No Records,,,
FOIA-2013-02483,OIP,8/27/13,Policies and procedures with respect to the administration of the FOIA,Provided requester with a copy of the DOJ FOIA Reference Guide and DOJ FOIA Regulations (28 C.F.R. Part 16),,,
FOIA-2013-03707,OLA,8/27/13,Copies of the Department of Justice's No FEAR Act Annual Reports since the inception of that law,Full Grant,,,
FOIA-2013-04312,OLA,8/27/13,"Correspondence to or from the office of Representative Paul Ryan from January 2, 1999 to the present",Partial Grant/Partial Denial,(b)(6),Information the release of which would constitute a clearly unwarranted invasion of the personal privacy of a third party ,
FOIA-2013-04575,OIP,8/27/13,"Records pertaining to an investigation and to the ""no fly"" list",Determined that Department of Homeland Security was the most appropriate entity for handling and referred requester to that agency for processing,,,
FOIA-2013-04758,OIP,8/27/13,Records from 2009 to the present concerning the Special Operations Division of the Drug Enforcement Administration,Determined that the DEA was the most appropriate entity for handling and referred requester to that component for processing,,,
FOIA-2013-04762,OIP,8/27/13,Records concerning Operation Dancing Brides,"Determined that the Executive Office for United States Attorneys, DOJ, was an appropriate entity for handling and referred request and requester to that component for processing; Also determined that the Department of State and U.S. Immigration and Customs Enforcement were also appropriate entities for handling and referred requester to those entities for additional information",,,
FOIA-2013-04493,OIP,8/28/13,"Records regarding Francisco Toscanino, an Italian national arrested in Uruguay in 1973, and later extradited to the United States to face drug trafficking charges","Determined that the National Archives and Records Administration, the DEA, the Criminal Division, and the Executive Office for United States Attorneys were the most appropriate entities for handling and referred requester to those entities for processing",,,
FOIA-2013-04559,OIP,8/28/13,"Copies of all acts of Congress granting standing to the ""United States of America"" to bring civil and/or criminal actions as Plaintiffs before District Courts as distinct from the Plaintiff ""United States""",Full Grant: Provided requester with publicly available copies of federal regulations and information from the DOJ website,,,
FOIA-2013-04822,OIP,8/28/13,"Documents from January 1, 2009 to December 31, 2011 concerning Gulf Cartel and human smuggling in or around Tamaulipas and Nuevo Leon, Mexico.","Determined that the DEA, and the Department of Homeland Security were the most appropriate entities for handling and referred requester to those entities for processing",,,
FOIA-2013-04824,OIP,8/28/13,"Documents, including investigations concerning motives or perpetuators, pertaining to the murder of seventy-two migrant workers in San Fernando, Mexico","Determined that the DEA, and the Department of Homeland Security were the most appropriate entities for handling and referred requester to those entities for processing",,,
FOIA-2013-04825,OIP,8/28/13,"Documents from September 1, 2010 to the present, including investigative records, concerning mass graves located in San Fernando, Tamaulipas, Mexico between September 1, 2010 to December 31, 2011",Provided requester with DOJ FOIA Reference Guide to help requester determine which Department component would maintain records on this topic; Determined that the Department of Homeland Security may also be an appropriate entity for handling and referred requester to that agency for processing,,,
FOIA-2013-04826,OIP,8/28/13,Documents concerning the disappearance and death of Robert Jaime Suarez Vazquez,Provided requester with DOJ FOIA Reference Guide to help requester determine which Department component would maintain records on this topic; Determined that the Department of Homeland Security may also be an appropriate entity for handling and referred requester to that agency for processing,,,
FOIA-2013-04869,OIP,8/28/13,List of all lawsuits filed by the Department of Justice against military or defense contractors for the years 2008 through 2013,Determined that the Executive Office for United States Attorneys was the most appropriate entity for handling and referred request and requester to that component for processing,,,
FOIA-2013-00050,PAO,8/29/13,"Copies of all communications from the Department of Justice's Office of Public Affairs between April 20, 2012 and April 27, 2012 concerning ""media matters"", and/or ""Ciaramella""",Partial Grant/Partial Denial,(b)(5); (b)(6),"Certain inter- and intra-agency communications protected by legal privileges; Information the release of which would constitute a clearly unwarranted invasion of the personal privacy of a third party 
",
FOIA-2013-01821,OASG,8/29/13,"Correspondence concerning marijuana between the Office of the Associate Attorney General and the state governments of Colorado, Washington, and California",No Records,,,
FOIA-2013-03483,OIP,8/29/13,"Records pertaining to all memoranda subsequent to the Webster L. Hubbell memorandum dated November 3, 1993, that were authored by the Department of Justice or the White House addressing the referral of agency documents to the White House in response to FOIA requests",Full Grant,,,
FOIA-2013-04558,OIP,8/29/13,Any FOIA reference documents including the Department of Justice Guide to the Freedom of Information Act,"Provided requester with DOJ Reference Guide, Table of Contents for current edition of the DOJ Guide to the FOIA so that requester could identify which sections were of interest, and contact information for the Government Printing Office should the requester wish to order a copy of the 2009 edition of the DOJ Guide to the FOIA",,,
FOIA-2013-04699,OIP,8/29/13,Documents from the U.S. Immigration and Customs Enforcement,"Determined that the U.S. Immigration and Customs Enforcement, DHS, was the most appropriate entity for handling and referred request and requester to that entity for processing",,,
FOIA-2013-04744,OIP,8/29/13,Listing of all federal agency FOIA contacts,Full Grant,,,
FOIA-2013-04866,OIP,8/29/13,Copy of the DOJ-NTIS agreement that specifies the monetary terms  governing the arrangement under which NTIS publishes the Drug Enforcement Administration data,Determined that the DEA was the most appropriate entity for handling and referred request and requester to that component for processing,,,
FOIA-2013-04954,OIP,8/29/13,The number of federal money laundering cases by state during Fiscal Years 2007-2013.,"Determined that the Executive Office for United States Attorneys, DOJ, was an appropriate entity for handling and referred request and requester to that component for processing",,,
FOIA-2013-00885,ODAG,8/30/13,Clemency files for named individuals,Partial Grant/Partial Denial,(b)(5),Certain inter- and intra-agency communications protected by legal privileges,
FOIA-2013-00891,OASG,8/30/13,Records pertaining to the Westboro Baptist Church and the Honoring America's Veterans and Caring for Camp Lejeune Families Act of 2012,No Records,,,
FOIA-2013-04840,OIP,8/30/13,Records pertaining to a third party,"Determined that the FBI, DEA, and the Executive Office for United States Attorneys, DOJ, were the most appropriate entities for handling and referred requester to those components for processing",,,
FOIA-2013-04918,OIP,8/30/13,FOIA contact information for the Federal Bureau of Investigation,Provided requester with FOIA contact information for the FBI,,,
FOIA-2013-04922,OIP,8/30/13,Information on how to file a complaint against the United States Federal Marshals,Provided requester with information on how to use the online DOJ Action Center,,,
FOIA-2013-04945,OIP,8/30/13,"Documents pertaining to the internal review of the use of videoconferencing technology at one of the immigration courts in Texas as referenced on page 35 of Funmi E. Olorunnipa’s report entitled, Agency Use of Video Hearings Best Practices and Possibilities for Expansion, Administrative Conference of the Unites States In-House Research Report, March 24, 2011","Determined that the Executive Office for Immigration Review, DOJ, was the most appropriate entity for handling and referred request and requester to that component for processing",,,
